{
	"cloudantAccount": "config_account",
	"cloudantDatabase": "config_database",
	"cloudantUser": "config_user",
	"cloudantPassword": "config_password",
	"tables": [{
		"name": "Testing",
		"fileNames": ["src/test/resources/x.csv"],
		"dbIdFields": ["nId"],
		"jsonDocumentType": "Testing",
		"jsonNestType": "PARENT",
		"dataFields": [{
			"dbFieldName": "nStockPrice",
			"jsonFieldName": "Price"
		}]
	}]
}