{
	"cloudantAccount": "juniorfoo",
	"cloudantDatabase": "db_importer_test",
	"cloudantUser": "xx",
	"cloudantPassword": "xx",
	"tables": [{
		"name": "Person",
		"jsonDocumentType": "Person",
		"dbIdFields": ["_id"],
		"useDatabase": true,
		"jsonNestType": "PARENT",
		"sqlUrl": "jdbc:hsqldb:mem:example",
		"sqlDriver": "org.hsqldb.jdbcDriver",
		"sqlUser": "sa",
		"sqlPass": "x",
		"sqlQuery": "select 1 from dual"
	}]
}